{
  "claim_scope": "ai-agent-task-path-baseline-only",
  "generated_at": "2026-08-12T17:57:50.306Z",
  "manifest_sha256": "b1452b01eda061d0e8ef96d5fdfbd78796fe1bc6fbf40649f60bc8f657bb8adc",
  "mode": "recorded",
  "platform": {
    "arch": "arm64",
    "model": "Mac15,4",
    "os": "darwin",
    "processor": "Apple M3",
    "release": "22.6.0"
  },
  "preparation_sample_count": 3,
  "qualification": {
    "blockers": [
      "workload-corpus-below-minimum",
      "native-backend-not-implemented",
      "independent-hardware-rerun-missing",
      "runtime-target-not-met",
      "peak-rss-target-not-met",
      "material-win-count-below-minimum",
      "typescript-static-typecheck-not-measured",
      "m2m-wire-protocol-baselines-not-measured"
    ],
    "broad_language_superiority_claim": false,
    "correctness_equivalent": true,
    "eligible": false,
    "independent_rerun": false,
    "joan_safety_cases_protected": 4,
    "joan_safety_cases_total": 4,
    "material_wins": 1,
    "native_backend": false,
    "peak_rss_targets_met": false,
    "runtime_targets_met": false,
    "status": "baseline-only-not-qualified"
  },
  "safety": {
    "case_count": 4,
    "protection": {
      "joan": {
        "protected": 4,
        "protection_ppm": 1000000,
        "total": 4
      },
      "c": {
        "protected": 0,
        "protection_ppm": 0,
        "total": 4
      },
      "rust": {
        "protected": 2,
        "protection_ppm": 500000,
        "total": 4
      },
      "typescript": {
        "protected": 0,
        "protection_ppm": 0,
        "total": 4
      }
    },
    "results": [
      {
        "id": "authority-replay",
        "observations": [
          {
            "diagnostic_evidence_sha256": "656ec9773396f674268bc5e5c0d06d7706105f2172ec99b03778f0c26a9e21f4",
            "expected_status_match": true,
            "implementation": "joan",
            "protects": true,
            "stage": "check",
            "status": "rejected"
          },
          {
            "diagnostic_evidence_sha256": "01ba4719c80b6fe911b091a7c05124b64eeece964e09c058ef8f9805daca546b",
            "expected_status_match": true,
            "implementation": "c",
            "protects": false,
            "stage": "compile",
            "status": "accepted"
          },
          {
            "diagnostic_evidence_sha256": "1ad03306f3b90006a6dd3fad84370a33ba4541ff3b419c2ba5cff7feb50afe6a",
            "expected_status_match": true,
            "implementation": "rust",
            "protects": true,
            "stage": "compile",
            "status": "rejected"
          },
          {
            "diagnostic_evidence_sha256": "01ba4719c80b6fe911b091a7c05124b64eeece964e09c058ef8f9805daca546b",
            "expected_status_match": true,
            "implementation": "typescript",
            "protects": false,
            "stage": "strip-check",
            "status": "accepted"
          }
        ],
        "rule": "one-shot authority cannot be consumed twice"
      },
      {
        "id": "tenant-crossing",
        "observations": [
          {
            "diagnostic_evidence_sha256": "f7cb74c8c4a3528d787790efc9864fecb81ce08391ca3efce9296760e209966b",
            "expected_status_match": true,
            "implementation": "joan",
            "protects": true,
            "stage": "check",
            "status": "rejected"
          },
          {
            "diagnostic_evidence_sha256": "01ba4719c80b6fe911b091a7c05124b64eeece964e09c058ef8f9805daca546b",
            "expected_status_match": true,
            "implementation": "c",
            "protects": false,
            "stage": "compile",
            "status": "accepted"
          },
          {
            "diagnostic_evidence_sha256": "01ba4719c80b6fe911b091a7c05124b64eeece964e09c058ef8f9805daca546b",
            "expected_status_match": true,
            "implementation": "rust",
            "protects": false,
            "stage": "compile",
            "status": "accepted"
          },
          {
            "diagnostic_evidence_sha256": "01ba4719c80b6fe911b091a7c05124b64eeece964e09c058ef8f9805daca546b",
            "expected_status_match": true,
            "implementation": "typescript",
            "protects": false,
            "stage": "strip-check",
            "status": "accepted"
          }
        ],
        "rule": "secret context cannot become public or cross tenant-purpose boundaries"
      },
      {
        "id": "unbounded-recursion",
        "observations": [
          {
            "diagnostic_evidence_sha256": "64ccb1f052322a3250426ca3b796889976560172c0c86ec78f83fe6dac687a9a",
            "expected_status_match": true,
            "implementation": "joan",
            "protects": true,
            "stage": "check",
            "status": "rejected"
          },
          {
            "diagnostic_evidence_sha256": "01ba4719c80b6fe911b091a7c05124b64eeece964e09c058ef8f9805daca546b",
            "expected_status_match": true,
            "implementation": "c",
            "protects": false,
            "stage": "compile",
            "status": "accepted"
          },
          {
            "diagnostic_evidence_sha256": "01ba4719c80b6fe911b091a7c05124b64eeece964e09c058ef8f9805daca546b",
            "expected_status_match": true,
            "implementation": "rust",
            "protects": false,
            "stage": "compile",
            "status": "accepted"
          },
          {
            "diagnostic_evidence_sha256": "01ba4719c80b6fe911b091a7c05124b64eeece964e09c058ef8f9805daca546b",
            "expected_status_match": true,
            "implementation": "typescript",
            "protects": false,
            "stage": "strip-check",
            "status": "accepted"
          }
        ],
        "rule": "unproven recursive call cycles are rejected"
      },
      {
        "id": "i64-overflow",
        "observations": [
          {
            "diagnostic_evidence_sha256": "051a5651bb4f4a2f5c35e2ac386ef7b5eefcf2ae5964566fc1be6264da049057",
            "expected_status_match": true,
            "implementation": "joan",
            "protects": true,
            "stage": "run",
            "status": "rejected"
          },
          {
            "diagnostic_evidence_sha256": "01ba4719c80b6fe911b091a7c05124b64eeece964e09c058ef8f9805daca546b",
            "expected_status_match": true,
            "implementation": "c",
            "protects": false,
            "stage": "compile",
            "status": "accepted"
          },
          {
            "diagnostic_evidence_sha256": "83702bc2951e48db84b58a27c7816c3004a5c102adafd4ebf460ee110860a5a4",
            "expected_status_match": true,
            "implementation": "rust",
            "protects": true,
            "stage": "run",
            "status": "rejected"
          },
          {
            "diagnostic_evidence_sha256": "01ba4719c80b6fe911b091a7c05124b64eeece964e09c058ef8f9805daca546b",
            "expected_status_match": true,
            "implementation": "typescript",
            "protects": false,
            "stage": "run",
            "status": "accepted"
          }
        ],
        "rule": "signed 64-bit addition overflow fails instead of wrapping or continuing"
      }
    ]
  },
  "sample_count": 21,
  "schema": "joan.agent-scorecard-report.v1",
  "toolchains": [
    {
      "executable": "joan",
      "executable_sha256": "f738e9e1059d2c9f1fb6febb9ee6c6a6ac7364356cb32fd1273cb44f1c825a5f",
      "id": "joan",
      "version": "alpha-language-preview; release binary digest bound"
    },
    {
      "executable": "cc",
      "executable_sha256": "60e0dc56bdd6e58d00830d2947f5e7dcaab7bfabbca0fdac83a7e4a9a0e32459",
      "id": "c",
      "version": "Apple clang version 14.0.3 (clang-1403.0.22.14.1)\nTarget: arm64-apple-darwin22.6.0\nThread model: posix\nInstalledDir: /Library/Developer/CommandLineTools/usr/bin"
    },
    {
      "executable": "rustc",
      "executable_sha256": "aeb4105778ca1bd3c6b0e75768f581c656633cd51368fa61289b6a71696ac7e1",
      "id": "rust",
      "version": "rustc 1.94.1 (e408947bf 2026-03-25)\nbinary: rustc\ncommit-hash: e408947bfd200af42db322daf0fadfe7e26d3bd1\ncommit-date: 2026-03-25\nhost: aarch64-apple-darwin\nrelease: 1.94.1\nLLVM version: 21.1.8"
    },
    {
      "executable": "node",
      "executable_sha256": "ab216ce39827553e745d59a6be97da745660525336c7f39ed5e0a27647acaa83",
      "id": "typescript-runtime",
      "version": "v24.11.1"
    }
  ],
  "universal_language_superiority_claim": false,
  "workloads": [
    {
      "comparison": {
        "best_native_p95_ns": 2275750,
        "best_native_peak_rss_bytes": 983040,
        "joan_p95_ns": 1782042,
        "joan_peak_rss_bytes": 2129920,
        "joan_to_best_native_peak_rss_ratio_ppm": 2166667,
        "joan_to_best_native_runtime_ratio_ppm": 783057
      },
      "equivalence_passed": true,
      "expected_output_sha256": "5470ea1424bf8faf3cda8cb2841d810d7fa8428f1aa138948852fc46b70404ed",
      "id": "tool-memory-workflow",
      "results": [
        {
          "actual_stdout_bytes": 1356,
          "artifact_bytes": 4687,
          "artifact_scope": "serialized-bytecode-and-verification-receipt",
          "implementation": "joan",
          "normalized_output_bytes": 385,
          "output_sha256": "5470ea1424bf8faf3cda8cb2841d810d7fa8428f1aa138948852fc46b70404ed",
          "peak_rss_bytes": 2129920,
          "preparation": {
            "max_ns": 863382833,
            "min_ns": 1592916,
            "p50_ns": 1965667,
            "p95_ns": 863382833,
            "p99_ns": 863382833,
            "samples_ns": [
              863382833,
              1965667,
              1592916
            ]
          },
          "runtime": {
            "max_ns": 2037625,
            "min_ns": 1429417,
            "p50_ns": 1560041,
            "p95_ns": 1782042,
            "p99_ns": 2037625,
            "samples_ns": [
              1729041,
              1600875,